{
  "$schema": "http://json-schema.org/draft-07/schema#",
  "$id": "https://cronagents.dev/cronagents-agent.schema.json",
  "title": "CronAgents Per-Agent Registration Configuration",
  "description": "Schema for per-agent registration files.",
  "type": "object",
  "definitions": {
    "scheduleInterval": {
      "type": "object",
      "properties": {
        "type": {
          "type": "string",
          "const": "interval"
        },
        "every": {
          "type": "string",
          "pattern": "^[0-9]+(h|m)$",
          "description": "Interval duration (minimum 30m). Examples: '1h', '30m', '2h'."
        }
      },
      "required": ["type", "every"],
      "additionalProperties": false
    },
    "scheduleDaily": {
      "type": "object",
      "properties": {
        "type": {
          "type": "string",
          "const": "daily"
        },
        "time": {
          "type": "string",
          "pattern": "^([01]\\d|2[0-3]):[0-5]\\d$",
          "description": "Time of day in HH:MM format."
        }
      },
      "required": ["type", "time"],
      "additionalProperties": false
    },
    "scheduleWeekly": {
      "type": "object",
      "properties": {
        "type": {
          "type": "string",
          "const": "weekly"
        },
        "day": {
          "type": "string",
          "enum": ["monday", "tuesday", "wednesday", "thursday", "friday", "saturday", "sunday"],
          "description": "Single day of the week (lowercase). Use either day or days."
        },
        "days": {
          "type": "array",
          "items": {
            "type": "string",
            "enum": ["monday", "tuesday", "wednesday", "thursday", "friday", "saturday", "sunday"]
          },
          "minItems": 1,
          "uniqueItems": true,
          "description": "One or more days of the week (lowercase). Use either days or day."
        },
        "time": {
          "type": "string",
          "pattern": "^([01]\\d|2[0-3]):[0-5]\\d$",
          "description": "Time of day in HH:MM format."
        }
      },
      "required": ["type", "time"],
      "oneOf": [
        {
          "required": ["day"],
          "not": { "required": ["days"] }
        },
        {
          "required": ["days"],
          "not": { "required": ["day"] }
        }
      ],
      "additionalProperties": false
    },
    "schedule": {
      "oneOf": [
        { "$ref": "#/definitions/scheduleInterval" },
        { "$ref": "#/definitions/scheduleDaily" },
        { "$ref": "#/definitions/scheduleWeekly" }
      ],
      "description": "When and how often the agent runs."
    },
    "runIfScript": {
      "type": "object",
      "properties": {
        "script": {
          "type": "string",
          "minLength": 1,
          "description": "PowerShell script path relative to the execution root. The script must write true or false to stdout."
        }
      },
      "required": ["script"],
      "additionalProperties": false
    },
    "quietHours": {
      "oneOf": [
        { "type": "null" },
        {
          "type": "object",
          "properties": {
            "start": {
              "type": "string",
              "pattern": "^([01]\\d|2[0-3]):[0-5]\\d$",
              "description": "Start of quiet hours in HH:MM format."
            },
            "end": {
              "type": "string",
              "pattern": "^([01]\\d|2[0-3]):[0-5]\\d$",
              "description": "End of quiet hours in HH:MM format."
            }
          },
          "required": ["start", "end"],
          "additionalProperties": false
        }
      ],
      "description": "Per-agent quiet-hours override for automatic scheduler dispatch. Omit to inherit global quietHours, set null to disable quiet hours for this agent, or provide start/end to use an agent-specific window. Manual runs are never blocked."
    }
  },
  "properties": {
    "$schema": {
      "type": "string",
      "description": "Path or URL to this schema file."
    },
    "name": {
      "type": "string",
      "description": "Display name for the agent."
    },
    "prompt": {
      "type": "string",
      "minLength": 1,
      "description": "The prompt to send to Copilot CLI."
    },
    "agent": {
      "type": "string",
      "minLength": 1,
      "description": "Agent file reference passed via the --agent flag."
    },
    "script": {
      "type": "string",
      "minLength": 1,
      "pattern": "\\.ps1$",
      "description": "Path to a PowerShell script (.ps1) to execute instead of Copilot CLI. Relative paths are resolved from the repo root."
    },
    "schedule": {
      "$ref": "#/definitions/schedule"
    },
    "runIf": {
      "oneOf": [
        { "type": "string", "const": "git-dirty" },
        { "type": "string", "pattern": "^file-changed:.+" },
        { "$ref": "#/definitions/runIfScript" }
      ],
      "description": "Optional execution condition. Use git-dirty, file-changed:<path>, or { \"script\": \"relative/path.ps1\" }."
    },
    "timeout": {
      "type": "string",
      "default": "10m",
      "pattern": "^[0-9]+(m|h|s)?$|^0$",
      "description": "Maximum run duration (e.g. '10m', '1h'). Default: '10m'."
    },
    "skipOnBattery": {
      "type": "boolean",
      "default": false,
      "description": "Skip execution when the machine is on battery power."
    },
    "quietHours": {
      "$ref": "#/definitions/quietHours"
    },
    "retryCount": {
      "type": "integer",
      "minimum": 0,
      "default": 0,
      "description": "Number of times to retry on process failure (non-zero exit code or timeout). Summary-derived functional failures are detected after the final attempt and are not retried."
    },
    "model": {
      "oneOf": [
        { "type": "string" },
        {
          "type": "array",
          "items": { "type": "string", "minLength": 1, "pattern": "\\S" },
          "minItems": 1
        },
        { "type": "null" }
      ],
      "description": "Model override for the Copilot CLI invocation. Either a single model name, or an ordered array of model names forming a fallback chain: each is tried in order, and the next is used when the Copilot CLI reports a model as unavailable. Model fallbacks are independent of retryCount."
    },
    "denyTools": {
      "type": "array",
      "items": { "type": "string" },
      "default": [],
      "description": "List of tool names to deny during the run."
    },
    "extraCliFlags": {
      "type": "array",
      "items": { "type": "string" },
      "default": [],
      "description": "Additional CLI flags passed to the Copilot CLI invocation."
    },
    "mcpServers": {
      "oneOf": [
        { "type": "array", "items": { "type": "string", "minLength": 1 }, "uniqueItems": true },
        { "type": "null" }
      ],
      "description": "MCP servers to enable for this run, selected by name from the user's ~/.copilot/mcp-config.json. Omit or set null to enable ALL servers from that file. An explicit empty array ([]) disables all MCP servers (built-in tools only)."
    },
    "workingDirectory": {
      "oneOf": [
        { "type": "string" },
        { "type": "null" }
      ],
      "description": "Working directory or project path for this agent. Null = use global default (allow all directories)."
    },
    "envVars": {
      "type": "object",
      "additionalProperties": { "type": "string" },
      "default": {},
      "description": "Environment variables to set for the agent run."
    },
    "notifyOnFailure": {
      "type": "boolean",
      "default": false,
      "description": "Show a Windows toast notification when the agent fails or times out."
    },
    "notifyOnSuccess": {
      "type": "boolean",
      "default": false,
      "description": "Show a Windows toast notification when the agent completes successfully."
    },
    "raiseAttention": {
      "type": "string",
      "enum": ["all", "failures-only", "significant-changes", "never"],
      "default": "all",
      "description": "Controls when the run-summarizer flags a run as needing attention. 'all' (default): flag on actionable failures (non-zero exit, timeout, or summary result failure), actionable results, and significant changes. 'failures-only': only on actionable failures. 'significant-changes': on actionable failures and significant changes such as codebase/PR changes or deployments, but not routine monitoring results. 'never': never flag attention (results are visible in the dashboard but won't trigger the banner)."
    },
    "notificationSound": {
      "type": "string",
      "anyOf": [
        {
          "enum": ["Default", "IM", "Mail", "Reminder", "SMS", "Alarm", "Call", "None"]
        },
        {
          "type": "string",
          "minLength": 1
        }
      ],
      "description": "Notification sound for this agent. Use a preset name (Default, IM, Mail, Reminder, SMS, Alarm, Call, None) or a file path to a custom .wav file. Alarm/Call variants (Alarm2–Alarm10, Call2–Call10) are also accepted. Only applies when notifyOnFailure or notifyOnSuccess is enabled and global notifications is true."
    }
  },
  "additionalProperties": false,
  "oneOf": [
    {
      "required": ["agent", "prompt", "schedule"],
      "not": { "required": ["script"] },
      "description": "Agent mode: runs a named agent with a prompt on a schedule."
    },
    {
      "required": ["prompt", "schedule"],
      "allOf": [
        { "not": { "required": ["agent"] } },
        { "not": { "required": ["script"] } }
      ],
      "description": "Prompt-only mode: runs a prompt without a specific agent on a schedule."
    },
    {
      "required": ["agent", "prompt"],
      "allOf": [
        { "not": { "required": ["schedule"] } },
        { "not": { "required": ["script"] } }
      ],
      "description": "Manual agent mode: runs a named agent with a prompt, triggered only via CLI or dashboard."
    },
    {
      "required": ["prompt"],
      "allOf": [
        { "not": { "required": ["agent"] } },
        { "not": { "required": ["schedule"] } },
        { "not": { "required": ["script"] } }
      ],
      "description": "Manual prompt-only mode: runs a prompt without a specific agent, triggered only via CLI or dashboard."
    },
    {
      "required": ["script", "schedule"],
      "allOf": [
        { "not": { "required": ["agent"] } },
        { "not": { "required": ["prompt"] } }
      ],
      "description": "Script mode: runs a user-provided script on a schedule."
    },
    {
      "required": ["script"],
      "allOf": [
        { "not": { "required": ["agent"] } },
        { "not": { "required": ["prompt"] } },
        { "not": { "required": ["schedule"] } }
      ],
      "description": "Manual script mode: runs a user-provided script, triggered only via CLI or dashboard."
    }
  ]
}
